Title,Abstract,Date
An Analysis of Conjunctive Goal Planning,"This thesis develops a formal theory of planning, using a simple paradigm of planning that has been previously explored in work such as GPS, HACKER, STRIPS and NOAH. This thesis analyzes the goal interactions that occur when the goal is stated as a conjunction of subgoals. In this analysis we assume that the problem has a finite state space, and that operators are reversible.  Graph theory can be used to characterize these subgoal interactions. The entire state space is treated as a graph, and each subgoal or conjunction of  subgoals defines a subgraph. Each subgraph is composed of one or more connected components. Solving each subgoal by choosing a connected component that contains a final goal state is a necessary and sufficient condition for solving any planning problem.  In the worst case, analyzing goal interactions is shown to be no more effective than enumerating the state space and searching. This complexity proves that no complete algorithm can solve all planning problems in linear time. The technique of goal ordering is analyzed, along with several extensions to that technique. While a generalization of goal ordering is possible, in the worst case generating the goal order requires as much computation as solving the problem by a brute-force search.  A technique called capability analysis, derived from the connect component results, uses first-order logic to find the constraints that must apply as subgoals are achieved. A partial implementation uses counterfactual logic to identify the components of a world state that prevent the remaining subgoals from being achieved.",1986
Using Group and Subsystem Level Analysis to Validate Software Metrics on Commercial Software Systems,"This paper reports the results of a study which examined the relationship between a collection of software metrics and the development data (such as errors and coding time) of three commercially produced software systems. The software metrics include both measures of system interconnectivity and measures of system code. This study revealed strong relationships between the metrics and the development data when individual components were aggregated by structure (into subsystems) or by similarity (into groups). The subsystem and group results imply that research and application of metrics should be focused above the component level. The group results also imply that metrics can guide the effective application of project resources by identifying those groups which, for example, will contain a disproportionately large fraction of errors.  Finally, the study showed the overall utility of two interconnectivity metrics: Henry and Kafura's information flow metric and McClure's invocation metric.  This result is significant because interconnectivity metrics can be applied early in the life cycle.",1988
Minimal Parameter Homotopies for the L2 Optimal Model Order Reduction Problem,"The problem of finding a reduced order model, optimal in the L2 sense, to a given system model is a fundamental one in control system analysis and design. The problem is very difficult without the global convergence of homotopy methods, and a number of homotopy based approaches have been proposed. The issues are the number of degrees of freedom, the well posedness of the finite dimensional optimization problem, and the numerical robustness of the resulting homotopy algorithm. Homotopy algorithms based on several formulations are developed and  compared here. The main conclusions are that dimensionality is inversely  related to numerical well conditioning and algorithmic efficiency is inversely related to robustness of the algorithm.",1992
What if There Were Desktop Access to the Computer Science Literature?,"What if there was an electronic computer science library? Consider the possibilities of having your favorite publications available within finger's reach. Consider project Envision, an ongoing effort to build a user-centered database from the computer science literature. This paper describes our first year progress, stressing the motivation underlying project Envision, user-centered development, and overall design.",1992
Low Error Path Planning for a Synchro-Drive Mobile Robot,"A path-planning system is presented which, given any points, calculates a low-error path for a synchro-drive robot. The path reduces dead-reckoning errors by using gentle, constant curvature turns for switching directions of the robot's travel---yet direct and minimal length travel are maintained. The system has been implemented and tested with a Vectrobot mobile platform.",1986
Spatial Reasoning in Remotely Sensed Data,"Photointerpreters employ a variety of implicit spatial  models to provide interpretations from remotely sensed  aerial or satellite imagery.  The process of making the  implicit models explicit and the subsequent use of explicit models in computer processing is difficult.  	In this paper one application is illustrated: 	how  ridges and valleys can be automatically interpreted from  LANDSAT imagery of a mountainous area and how a relative  elevation terrain model can  be constructed from this  interpretation.  It is shown how an illumination model is  being used to explain many of the features of a LANDSAT  image.  Finally, it is shown how to examine valleys for the  possible presence of streams or rivers and it is shown how a  spatial relational model can be set up to make a final  interpretation of the river drainage network.",1981
Verification and Validation: What Impact Should Project Size and Complexity Have on Attendant V&V Activities and Supporting Infrastructure?,"The size and complexity of Modeling and Simulation (M&S) application continue to grow at a significant rate. The focus of this panel is to examine the impact that such growth should have on attendant Verification and Validation (V&V) activities. Two prominent considerations guiding the panel discussion are: (1) Extending the current M&S development objectives to include quality characteristics like maintainability, reliability, and reusability -- the current modus operandi focuses primarily on correctness, and (2) Recognizing the necessity and benefits of tailoring V&V activities commensurate with the size of the project, i.e., one size does not fit all. In this paper we provide six questions and four sets of responses to those questions. These questions and responses are intended to foster additional thought and discussion on topics crucial to the synthesis of quality M&S applications.",1999-11-01
A Visual Simulation Support Environment Based on the DOMINO Conceptual Framework,"The purpose of this paper is to present a Visual Simulation Support Environment (VSSE) based on the multifaceD coOnceptual fraMework for vIsual simulatioN mOdeling (DOMINO). The ever-increasing complexity of visual simulation model development is undeniable. There is a need for automated support throughout the entire visual simulation model development life cycle. This support is furnished by the VSSE which is composed of integrated software tools providing computer-aided assistance in the development and execution of a visual simulation model. The VSSE has been jointly developed with the DOMINO. Its architecture consists of three layers: hardware and operating system, kernel VSSE, minimal VSSE, and VSSEs. This paper focuses on the minimal VSSE toolset. Evaluation of the VSSE shows that it adequately satisfies all of its 13 design objectives.",1992
"The Swan User's Manual, Version 1.1",Swan is a data structure visualization program.  Its main purpose is to allow the user to visualize the data structures used in a C/C++ program.  Swan is specifically designed to support visualization of programs implementing various graph algorithms.,1995-08-01
HSCT Configuration Design Space Exploration Using Aerodynamic Response Surface Approximations,"A method has been developed to generate and use polynomial approximations to the range and cruise drag components in a highly constrained, multidisciplinary design optimization of a High Speed Civil Transport configuration.  The method improves optimization performance by eliminating the numerical noise present in the analyses through the use of response surface methodology.  In our implementation, we fit quadratic polynomials within variable bounds to data gathered from a series of numerical analyses of different aircraft designs.  Because the HSCT optimization process contains noise and suffers from a nonconvex design space even when noise is filtered out, multiple optimization runs are performed from different starting points with and without the response surface models in order to evaluate their effectiveness.  It is shown that response surface methodology facilitates design space exploration, allowing improvements in terms of both convergence performance and computational effort when multiple starting points are required.",1999-03-01
Massively Parallel Simulations with Application to Queueing Networks,"This paper investigates two parallel simulation methodologies, multiple replication and parallel regenerative simulation.  Problems of applying these methodologies to massively parallel simulations are identified.  Two approaches (MR-PI and PR) are proposed to overcome some of these problems.  The MR-PI approach, based on multiple replication simulation, uses a pilot simulation to reduce the initial transient bias by starting the simulation from a state that is representative of the steady-state conditions.  The PR approach allows approximate regeneration by using substate matching for models that do no regenerate frequently.  Empirical results suggest that the proposed approaches can produce very accurate results.",1995-02-01
Cross-Platform Presentation of Interactive Volumetric Imagery,"Volume data is useful across many disciplines, not just medicine. Thus, it is very important that researchers have a simple and lightweight method of sharing and reproducing such volumetric data. In this paper, we explore some of the challenges associated with volume rendering, both from a classical sense and from the context of Web3D technologies. We describe and evaluate the pro- posed X3D Volume Rendering Component and its associated styles for their suitability in the visualization of several types of image data. Additionally, we examine the ability for a minimal X3D node set to capture provenance and semantic information from outside ontologies in metadata and integrate it with the scene graph.",2012
The Evaluation of Software Quality: An Empirical Approach to Validation,"This interim report outlines activities related to the Software Quality Assessment Project funded by the JLC/CRM. Reported activities reflect investigative efforts performed at the Systems Research Center (Virginia Tech) and at the Melpar Division of E-Systems. Accordingly, this report discusses (1) the development and installation of a document analyzer, (2) the development and refinement of document quality and process indicators, and (3) our approach to data collection. An outline of planned activities for the next reporting period is also presented.",1992
Identifying Native Applications with High Assurance,"The work described in this paper investigates the problem of identifying and deterring stealthy malicious processes on a host. We point out the lack of strong application iden- tication in main stream operating systems. We solve the application identication problem by proposing a novel iden- tication model in which user-level applications are required to present identication proofs at run time to be authenti- cated by the kernel using an embedded secret key. The se- cret key of an application is registered with a trusted kernel using a key registrar and is used to uniquely authenticate and authorize the application. We present a protocol for secure authentication of applications. Additionally, we de- velop a system call monitoring architecture that uses our model to verify the identity of applications when making critical system calls. Our system call monitoring can be integrated with existing policy specication frameworks to enforce application-level access rights. We implement and evaluate a prototype of our monitoring architecture in Linux as device drivers with nearly no modication of the ker- nel. The results from our extensive performance evaluation shows that our prototype incurs low overhead, indicating the feasibility of our model.",2011
"Between a Rock and a Cell Phone: Social Media Use during Mass Protests in Iran, Tunisia and Egypt","In this paper we examine the use of social media, and especially Twitter, in Iran, Tunisia and Egypt during the mass political demonstrations and protests in June 2009, December 2010 - January 2011, and February 2011, respectively.  We compare this usage with methods and findings from other studies on the use of Twitter in emergency situations, such as natural and man-made disasters.  We draw on our own experiences and participant-observations as an eyewitness in Iran (first author), and on Twitter data from Iran, Tunisia and Egypt. In these three cases, Twitter filled a unique technology and communication gap at least partially.  We summarize suggested directions for future research with a view of placing this work in the larger context of social media use in conditions of crisis and social convergence.",2011-05-01
Affordances and Feedback in Nuance-Oriented Interfaces,"Virtual Environments (VEs) and perceptive user interfaces must deal with complex users and their modes of interaction. One way to approach this problem is to recognize users’ nuances (subtle conscious or unconscious actions). In exploring nuance-oriented interfaces, we attempted to let users work as they preferred without being biased by feedback or affordances in the system. The hope was that we would discover the users’ innate models of interaction. The results of two user studies were that users are guided not by any innate model but by affordances and feedback in the interface. So, without this guidance, even the most obvious and useful components of an interface will be ignored.",2001
Parallel Adaptive GMRES Implementations for Homotopy Methods,"The success of homotopy methods in solving large-scale optimization problems and nonlinear systems of equations depends heavily on the solution of large sparse nonsymmetric linear systems on parallel architectures.  Iterative solution techniques, such as GMRES(k), favor parallel implementations.  However, their straightforward parallelization usually leads to a poor parallel performance because of global communication incurred by processors.  One variation of GMRES(k) considered here is to adapt the restart value k for any given problem and use Householder reflections in the orthogonalization phase to achieve high accuracy and reduce the communication overhead.",1997-11-01
Uncertainty Quantification and Apportionment in Air Quality Models using the Polynomial Chaos Method,"Simulations of large-scale physical systems are often affected by the uncertainties in data, in model parameters, and by incomplete knowledge of the underlying physics. The traditional deterministic simulations do not account for such uncertainties. It is of interest to extend simulation results with ``error bars'' that quantify the degree of uncertainty. This added information provides a confidence level for the simulation result. For example, the air quality forecast with an associated uncertainty information is very useful for making policy decisions regarding environmental protection. Techniques such as Monte Carlo (MC) and response surface are popular for uncertainty quantification, but accurate results require a large number of runs. This incurs a high computational cost, which maybe prohibitive for large-scale models. The polynomial chaos (PC) method was proposed as a practical and efficient approach for uncertainty quantification, and has been successfully applied in many engineering fields. Polynomial chaos uses a spectral representation of uncertainty. It has the ability to handle both linear and nonlinear problems with either Gaussian or non-Gaussian uncertainties.   This work extends the functionality of the polynomial chaos method to Source Uncertainty Apportionment (SUA), i.e., we use the polynomial chaos approach to attribute the uncertainty in model results to different sources of uncertainty. The uncertainty quantification and source apportionment are implemented in the Sulfur Transport Eulerian Model (STEM-III). It allows us to assess the combined effects of different sources of uncertainty to the ozone forecast. It also enables to quantify the contribution of each source to the total uncertainty in the predicted ozone levels.",2007
Representing Knowledge About Words,"Most on-line lexicons contain only semantic information.  Semantic information is usually stored elsewhere, in a form consistent with representation of the syntactic information.  This paper reports on research toward developing a large on-line lexicon from machine-readable dictionaries, which contains both syntactic and semantic information in uniform style.  The fundamental theory is that of one of the relational lexicon; we describe relational lexicons, discuss our extensions to the usual theory of relational lexicons, rehearse very quickly some of the relations we are dealing with, and show how information for some simple entries is stored.",1989
Proceedings of the Fourth Annual Virginia Tech Center for Human-Computer Interaction Research Experience for Undergraduates (REU) Symposium,"Virginia Tech's Center for Human-Computer Interaction presents the project abstracts for the REU 2009 symposium. The REU (Research Experience for Undergraduates) program provides undergraduate students from various universities with the opportunity to spend eight weeks at Virginia Tech, working with our faculty and graduate students on research projects using the state-of-the-art technology and laboratories assembled here.  The REU program is sponsored primarily by the National Science Foundation (IIS-0851774, IIS-0552732).  Additional support was provided by the NSF (CNS-0540509), the VT CS Department CSRC, and IBM Research.",2009
"Collecting, Analyzing and Visualizing Tweets using Open Source Tools","This tutorial will teach participants how to collect, analyze and visualize results from twitter data.  We will demonstrate several different free, open-source web-based tools that participants can use to collect twitter data (e.g., Archivist, 140kit.com, TwapperKeeper), and show them a few different methods, tools or programs they can use to analyze the data in a given collection.  Finally, we will show participants visualization tools and programs they can use to present the analyses, such as tag clouds, graphs and other data clustering techniques.  As much as possible this will be a hands-on tutorial, so participants can learn by making their own twitter data collection, analysis and visualization as part of the tutorial.",2011
Modeling Networks with Dynamic Topologies,"Dynamic hierarchical networks represent an architectural strategy for employing adaptive behavior in applications sensitive to highly variable external demands or uncertain internal conditions. The characteristics of such architectures are described, and the significance of adaptive capability is discussed. The necessity for assessing cost/benefit tradeoffs leads to the use of queueing network models. The general model, a network of M/M/1 queues in a random environment, is introduced and then is simplified so that the links may be treated as isolated M/M/1 queues in a random environment. This treatment yields a formula for approximate mean network delay by combining matrix-geometric results (mean queue length and mean delay) for the individual links. A discrete event simulation model is defined as a basis for cross-validation of the analytic model. Conditions under which the analytic model is considered valid are identified through comparison of the two models.",1988-05-01
Issues Related to the Explication of Process-Product Relationships in DoD-Std-21677 and DoD-Std-2168,"This paper is a discussion of issues related to the thesis entitled, ""The Explication of Process-Product Relationships in DoD-STD-2167 and DoD-STD-2168 via an Augmented Data Flow Diagram Model.""  In particular, the major results of the above thesis are viewed in light of the draft standards DoD-STD-2167 and DoD-STD-2168 (both dated 1 April 1987), and the issue of development objectives is explored.  The ideas presented in this paper represent the author's opinion and are speculative in nature due to the fact that, at present, the revised DoD standards are in draft form, and the issue of development objectives has not yet been thoroughly investigated.",1988
Microprogrammable Cellular Automata,"This paper reports research into cellular automata with two binary inputs, two binary outputs, and an octal control variable. A set of control variables is chosen and it is shown that any function of three variables can be realized by a 2 x 2 array of cells, any function of four variables by a 2 x 6 array of cells. A construction based on the Shannon Decomposition Theorem is given for the realization of functions of more than four variables. The existence of a more efficient construction is conjectured. A definition of the circuit  defining the cell is given as well as an implementation using NAND gates. A practical configuration of the cells is suggested and fault correction is discussed.",1973
"BABES: Brushing+Linking, Attributes, and Blobs Extension to Storyboard","In this day and age, people not only deal with data but deal  with vast amounts of data which needs to be sorted and made sense of.  A subset of these people are intelligence analysts who sort through an  enormous amount of data that need to be organized to uncover plots and  subplots. We are proposing a tool called BABES (Brushing+Linking,  Attributes, and Blobs Extension to Storyboard) that will enable the  intelligence analyst to sort through data efficiently, uncover plots and  subplots using the brushing and linking and attributes features and work  with multiple subplots at the same time using the concept of ’blobs’.",2008
Anticipating and Mitigating the Professional Challenge to Independent Verification and Validation,"Independent Verification and Validation faces three classes of challenges: the Technical Challenge, the Management Challenge, and the Professional Challenge.  In this paper we focus on the Professional Challenge, and, in particular, the four phases that characterize it: Denial, Anger, Cooperation and Dependence.  We believe that to implement an effective IV&V effort, one must understand the relationship among the phases and the critical issues underlying them.  For each of the phases we (a) provide a characteristic description, (b) discuss how they affect the IV&V effort, (c) present representative issues and examples, and (d) describe steps to reduce the adverse impact of the three detrimental phases.  The examples provided are those we have encountered while serving in an IV&V capacity; ""lessons learned"" guide our suggestions for addressing phase-specific issues.",1998-03-01
A Taxonomical Review of Object-Oriented Simulation Model Verification and Validation Techniques,"The goal of this paper is to provide a taxonomical review of verification and validation (V&V) techniques for assessing the accuracy of object-oriented simulation models and to present guidelines for the selection of the techniques based on their effectiveness and costs.  The techniques are evaluated based on the identified indicators that relate the techniques to their error detecting capability and the costs that measure the ease-of-use aspects.  The paper introduces a preliminary object-oriented model fault taxonomy based on a comprehensive literature survey and authors' experience.  The fault taxonomy not only compares and contrasts the error detection capabilities of the techniques but also provides a basis and guidance for detecting specific faults likely to occur due to complexities of object-oriented paradigm such as object/class hierarchies. state-dependent behavior, dynamic and diverse patterns of interactions, among the objects.  The guidelines and the comparative analysis of the object-oriented V&V techniques allow practitioners to select the techniques based on the benefits and costs.",1998-03-01
