Title,Abstract,Date
Finding All Isolated Solutions to Polynomial Systems Using Hompack,"Although the theory of polynomial continuation has been established for over a decade (following the work of Garcia, Zangwill, and Drexler), it is difficult to solve polynomial systems using continuation in practice. Divergent paths (solutions at infinity), singular solutions, and extreme scaling of coefficients can create catastrophic numerical problems.  Further, the large number of paths that typically arise can be discouraging.  In this paper we summarize polynomial-solving homotopy continuation and report on the performance of three standard path-tracking algorithms (as implemented in HOMPACK) in solving three physical problems of varying degrees of difficulty. Our purpose is to provide useful information on solving polynomial systems; including specific guidelines for homotopy construction and parameter settings. The m-homogeneous strategy for constructing polynomial homotopies is outlined, along with more tradition approaches.  Computational comparisons are included to illustrate and contrast the major HOMPACK options. The conclusions summarize our numerical experience and discuss areas for future research.",1987
InTouch Usability Evaluation,"The main purpose of this test was to asses the performance of an actual customer with little or no previous InTouch experience. The usability test measured the total time needed to accomplish information entry and output, and record user critical incidents. Tasks included routine operations, print operations, and import/export of data.  Each test session consisted of a performance test where the user performed a series of tasks, and a post-test interview where the user filled out a brief user preference questionnaire about the functionality and usability of InTouch and was given the opportunity to make comments or ask questions about InTouch.  Evaluation measures included: observations and comments for each critical incident; classification of errors associated with critical incidents including severity, scope, and source of error; the time necessary to complete each task; the percentage of participants who successfully complete each task; and user rankings of the functionality and usability of InTouch.  All participants did fulfill InTouch developer goals of having users succeed in entering information into InTouch within the first 5-10 minutes of use and outputting information from InTouch within the first half hour of use. Although, many participants did have major problems.  User likes included the InTouch documentation, the exclusion option in sort, the option of creating a new group from the group search dialog box, the choice of sounds for reminders, and the repeat option for reminders.  User dislikes included having to search the giant InTouch menu, the difficulty figuring out the function of the different panes in the main window, the lack of on-line help, and the lack of access to group functions from the main window. Users also disliked InTouch not behaving like other Macintosh applications: its files could not be opened by double-clicking, and no one liked having to select InTouch from the menu to start-up the program. Most users also had problems with the print and layout dialog boxes.  Problems were rated in terms of severity and scope, and whenever possible, the source of the problems and potential solutions were indicated. The solutions presented in this report are just recommendations. Re-design efforts should consider alternative solutions with both the problems and potential solutions evaluated in light of the total system.",2001-08-01
Usability Inspection Report of iLumina,"iLumina is a digital library of sharable undergraduate teaching resource materials for science, mathematics, technology, and engineering being developed by the University of North Carolina at Wilmington (UNCW), Collegis, Virginia Tech, Georgia State University, Grand Valley State and The College of New Jersey. Types of iLumina resources include papers, tutorials, applets, presentations, visualizations, experiments, assignments, software, exercises.",2002-09-01
A Tri-Valued Belief Network Model for Information Retrieval,A Tri-Valued Belief Network Model for Information Retrieval.,2001-12-01
Link Capacity Assignment in Dynamic Hierarchical Networks,"The dynamic hierarchy, which is a generalization of the centralized, tree structured network, is introduced in this paper. First, a queueing network model of the dynamic hierarchy is formulated. Following the derivation of a network performance measure, probabilistic and heuristic assignment strategies are created. These strategies are compared through the use of analysis of variance procedures and preferred strategies are selected. It is found that a relatively simple heuristic strategy produces capacity assignments whose quality is comparable to that of the preferred probabilistic strategy.",1987
A Complete Horizontal Microlanguage,"This paper defines a data space whose points are trees with leaves which are [name,value] pairs. Over this space a substitution operator S (meaning informally ""in x for y put z"") is formally defined. Taken together with several auxiliary operators, S is shown to be sufficient to define a large class of high-level languages since S is known to be functionally complete for finite-valued spaces, a functionally complete language is exhibited.",1973
A DOS-M Primer,No abstract available.,1974
Pinch Keyboard: Natural Text Input for Immersive Virtual Environments,"Text entry may be needed for system control tasks in immersive virtual environments, but no efficient and usable techniques exist. We present the pinch keyboard interaction technique, which simulates a standard QWERTY keyboard using Pinch Gloves™ and 6 DOF trackers. The system includes visual and auditory feedback and a simple method of calibration.",2001
Efficient Uncertainty Quantification with the Polynomial Chaos Method for Stiff Systems,"The polynomial chaos method has been widely adopted as a computationally feasible approach for uncertainty quantification. Most studies to date have focused on non-stiff systems. When stiff systems are considered, implicit numerical integration requires the solution of a nonlinear system of equations at every time step. Using the Galerkin approach, the size of the system state increases from $n$ to $S \times n$, where $S$ is the number of the polynomial chaos basis functions. Solving such systems with full linear algebra causes the computational cost to increase from $O(n^3)$ to $O(S^3n^3)$. The $S^3$-fold increase can make the computational cost prohibitive. This paper explores computationally efficient uncertainty quantification techniques for stiff systems using the Galerkin, collocation and collocation least-squares formulations of polynomial chaos. In the Galerkin approach, we propose a modification in the implicit time stepping process using an approximation of the Jacobian matrix to reduce the computational cost. The numerical results show a run time reduction with a small impact on accuracy. In the stochastic collocation formulation, we propose a least-squares approach based on collocation at a low-discrepancy set of points. Numerical experiments illustrate that the collocation least-squares approach for uncertainty quantification has similar accuracy with the Galerkin approach, is more efficient, and does not require any modifications of the original code.",2007
POLSYS_PLP: A Partitioned Linear Product Homotopy Code for Solving Polynomial Systems of Equations,"Globally convergent, probability-one homotopy methods have proven to be very effective for finding all the isolated solutions to polynomial systems of equations.  After many years of development, homotopy path trackers based on probability-one homotopy methods are reliable and fast.  Now, theoretical advances reducing the number of homotopy paths that must be tracked, and in the handling of singular solutions, have made probablitiy-one homotopy methods even more practical.  POLSYS_PLP consists of Fortran 90 modules for finding all isolated solutions of a complex coefficient polynomial system of equations.  The package is intended to be used in conjunction with HOMPACK90 (algorithm 777), and makes extensive use of Fortran 90 derived data types to support a partitioned linear product (PLP) polynomial system structure.  PLP structure is a generalization of m-homogeneous structure, whereby each component of the system can have a different m-homogeneous structure.  POLSYS_PLP employs a sophisticated power series end game for handling singular solutions, and provide support for problem definition both at a high level and via hand-crafted code.  Different PLP structures and their corresponding Bezout numbers can be systematically explored before committing to root finding.",1998-08-01
Parallel Deterministic and Stochastic Global Minimization of Functions with Very Many Minima,"The optimization of three problems with high dimensionality and many local minima are investigated under five different optimization algorithms: DIRECT, simulated annealing, Spall’s SPSA algorithm, the KNITRO package, and QNSTOP, a new algorithm developed at Indiana University.",2011
Building the CODER Lexicon: The Collins English Dictionary and Its Adverb Definitions,"The CODER (COmposite Document Expert/extended/effective Retrieval) project is an investigation of the applicability of artificial intelligence techniques to the information retrieval task of analyzing, storing, and retrieving heterogeneous collections of ""composite documents."" In order to support some of the processing desired, and to allow experimentation in information retrieval and natural language processing, a lexicon was constructed from the machine readable Collins dictionary of the English Language.  After giving background, motivation, and a survey of related work, the Collins lexicon is discussed.  Following is a description of the conversion process, the format of the resulting Prolog database, and characteristics of the dictionary and relations. To illustrate what is present and to explain how it relates to the files produced from Webster's Seventh New Collegiate Dictionary, a number of comparative charts are given. Finally, a summary of adverb definitions is presented, together with a description of defining formula that usually indicate the type of the adverb. Ultimately it is hoped that definitions for adverbs and other words will be parsed so that the relational lexicon being constructed will include many additional relationships and other knowledge about words and their usage.",1986-10-01
Instructional Footprinting: A Basis for Exploiting Concurrency Through Instructional Decomposition and Code Motion: A Research Prospectus,"In many languages, the programmer is provided the capability of communicating, through the use of function calls, with other, separate, independent processes. This capability can be simple, as a service request made to the operating system, or more advanced, as Tuple space operations specific to a Linda programming system. The problem with such calls, however, is that they block while waiting for data of information to be returned. This synchronous nature and lack of concurrency can be avoided by initiating the request for data earlier in the code and retrieving the returned data later when it is needed. In order to facilitate this concurrency of processing, an instructional footprint model is developed which formally describes movement of instruction. This paper presents a proposal for research that involves the development of the instructional footprint model and an algorithmic framework in which to exploit concurrency in programming languages.",1992
A Distributed Parallel Processing Environment Based upon the Linda Paradigm: A Research Prospectus,"As the computing capacity of the uniprocessor is being taxed, and the high cost of parallel and super-computers is still prevalent, alternative methods of achieving parallel performance at an economical price are desired. This proposed research effort offers one such alternative, focusing on the idle CPU cycles existing on local area networks. With the increase in the computing power of workstations and their declining costs, one can effectively transform the unused computing power attached to a local area network into a parallel processing environment. Effectively exploiting such an environment, however, requires a specification and operational framework that is portable, easy to use, and efficient. The environment is constructed around the Linda parallel programming paradigm which provides an effective parallel computational framework.",1992
On the Relationship Between the Object-Oriented Paradigm and Software Reuse: An Empirical Investigation,"This paper describes the results of a controlled experiment designed to evaluate the impact of the object-oriented paradigm on software reuse. The experiment concludes that (1) the object-oriented paradigm substantially improves productivity over the procedural paradigm, (2) language differences are far more important when programmers reuse than when they do not, (3) under both moderate and strong encouragement to reuse, the object-oriented paradigm promotes higher productivity than the procedural paradigm, (4) software reuse improves productivity no matter which language paradigm is used, and (5) the object-oriented paradigm has a particular affinity to the reuse process.",1992
The Abstraction Refinement Model and the Modification-Cost Problem,"A problem common to systems and software engineering is that of estimating the cost of making changes to a system. For system modifications that include changes to the design history of the system this is the ""modification-cost"" problem. A solution to this problem is important to planning changes in large systems engineering projects. In this paper, a cost model based on the Abstraction Refinement Model (ARM) is proposed as a framework for deriving solutions to the modification-cost problem. The ARM is a characterization of software evolution that is also applicable to general systems. Modifications to systems and their design histories are described using the components of the ARM. The cost model is defined by functions on the ARM components. The derived solution is given by an abstract expression of the cost functions.",1992
Implementing Communication Protocols Using Object-Oriented Techniques,"In this paper, elements of an object-oriented implementation of the upper layer OSI protocols are presented. Our goal in the paper is two-fold. First, to communicate to software engineers, particularly those developing systems software, that object-oriented programming techniques facilitate and enhance the implementation of layered architectures. Second, to convey to language designers our experience using object-oriented language features in building communications protocols. We focus on the requirements for the upper layer OSI protocols and illustrate how inheritance, subtyping, and polymorphic function effect their implementation.",1992
Turing's Test and Conscious Thought,"Over 40 years ago, A. M. Turing proposed a test for intelligence in machines. Based as it is, solely on an examinee's verbal responses, the Test misses some important components of human thinking. To bring these manifestations within its scope, the Turing Test would require substantial extension. Advances in the application of AI methods in the design of improved human-computer interfaces are now focusing attention on machine models of thought and knowledge from the altered standpoint of practical utility.",1992
Least Change Secant Update Methods for Undetermined Systems,"Least-change secant updates for nonsquare matrices have been addressed recently in [6].  Here we consider the use of these updates in iterative procedures for the numerical solution of underdetermined systems. Our model method is the normal flow algorithm used in homotopy or continuation methods for determining points on an implicitly defined curve. A Kantorovich-type local convergence analysis is given which supports the use of least-change secant updates in this algorithm. This analysis also provides a Kantorovich-type local convergence analysis for least-change secant update methods in the usual case of an equal number of equations and unknowns. This in turn gives a local convergence analysis for augmented Jacobian algorithms which use least-change secant updates. We conclude with the results of some numerical experiments.  Key words. underdetermined systems, least-change secant update methods, quasi-Newton methods, normal flow algorithm, augmented Jacobian matrix algorithm, continuation methods, homotopy methods, curve-tracking algorithms, parameter-dependent systems",1988
Notational Techniques for Accommodating User Intention Shifts,"Good user interface designs allow for user intention shifts.  The asynchronous nature of direct maniulation interfaces inherently demands consideration of user intention shifts during the performance of a task. Maintaining a focus on the primary function of a task while at the same time accommodating user intention shifts is difficult for interface designers when both these aspects are represented at the same design level.  The User Action Notation (UAN), a technique for representing asynchronous interfaces, contains a mechanism for specifying points in a task where user intention shifts may occur.  A complementary technique, Task Transition Diagrams (TTDs), is used to specify tasks that users can perform to interrupt their current task.  The Task Transition Diagram is a notation that allows a designer to map out the set of tasks and intentions of users without having to be concerned with the minutiae of how a user accomplishes those tasks.",1990
Estimating and Predicting Error Detection Trends and Relative Manpower Utilization,"The work described in this paper outlines an investigative effort focusing on estimating the number of errors remaining in a software product and the effort required to detect those errors.  More specifically, we provide a description of a computational model that, through a non-linear optimization process: (a) determines an error detection trend in a given development effort, (b) provides an estimate of the errors remaining in the product and the time required to detect those errors, and (c) relates the error detection effort to current and future manpower requirements.  The model is simple to use, requiring only error counts and detection dates as input, and is grounded in the time-tested theory underlying Musa's Basic Reliability Model and the Rayleigh Manpower Utilization Curve.  The model has been developed under the auspices of the Software Assurance Technology Center (SATC) at NASA/GSFC.  Data sets from various NASA projects were used in formulating and tuning the model.  For research purposes, the model was initially developed within an Excel framework; a more robust implementation is currently underway.",1998-03-01
Flexible Collaboration Transparency,"This paper presents two distinct contributions: First, we present a critique of collaboration transparency as it is currently implemented in contrast to collaboration-aware implementations.  We find conventional collaboration-transparency systems lacking in terms of efficient use of network resources and support for key groupware principles: concurrent work, relaxed WYSIWIS, and group awareness. Second, we examine the causes of these deficiencies, and then present an alternative implementation approach based on an object-oriented replicated architecture where selected single-user interface objects are dynamically replaced by multi-user extensions.  The replacement is transparent to the single-user application and its developer.  As an instance of this approach, we described its incorporation into a Java-based collaboration-transparency system, called JAMM.",1998-04-01
Sorting by Short Block-Moves,"Sorting permutations by operations such as reversals and block-moves has received much interest because of its applications in computational biology, particularly in the study of genome rearrangements.  A short block-move is an operation on a permutation that moves an element at most two positions away from its original position.  This paper investigates the problem of finding a minimum-length sorting sequence of short block-moves for a given permutation.  A 4/3-approximation algorithm for this problem is presented.  Exact polynomial-time algorithms are presented for woven bitonic permutations and woven double-strip permutations.  A linear-time maximum matching algorithm for a special class of grid graphs is also discovered that improves the time complexity of one of these exact algorithms.",1998-02-01
The JONES Microprocessor: User's Manual,This technical report is no longer available.,1987
Improving Concurrency in Common Object Models,"Most common object models of distributed object systems lack features related to 'concurrency' (the ability to have more than one thread of execution in an object simultaneously).  The lack of support for concurrency restricts the development of new components and limits reuse of existing components that use these advanced features.  In this paper, the concurrency features of the Interoperable Common Object Model (ICOM) centered on statically typed object-oriented languages, is presented.  The ICOM model is an attempt to elevate common object models (with the advanced features of concurrency) closer to the object models of statically typed object-oriented languages.  Specific features of the ICOM object model include: atomic objects and guard methods.  The actor model is used to develop a uniform implementation framework for the ICOM object model in C++ and Modula-3.",1998-03-01
A Generalized Comparison of Quadtree and Bintree Storage Requirements,"The quadtree and bintree data structures are two variants on the principle of hierarchical regular decomposition applied to image representation.  A comparison of the storage requirements for images represented by these two methods is presented.  The relative storage efficiency of quadtrees and bintrees is determined by two factors: the relative mode size for the two representations as determined by the data structure implementation, and the number of quadtree leaf node pairs that merge to form a single leaf node after conversion to the bintree representation.  The merging probability is analyzed, and found to be close to 0.5 for most images.  The resulting storage efficiency for a number for representative implementations is discussed.  Each of the data structures has implementations (and associated applications) for which it is more space efficient.",1989
Automated Theorem-proving and Program Verification: An Annotated Bibliography,"This bibliography contains a synopsis of each reference, taken from  one of three sources:  (1) the author's abstract;  (2) the review of the reference in ACM Computing Reviews;  (3) an abstract prepared locally.  The third alternative was chosen only if the first two were unavailable.  Each reference is identified by a number with prefix PV or A (program  verification or automated theorem-proving) depending upon its contents, and  the identification number is used for cross-referencing the entries. If a  reference deals with both areas, it has two identification numbers. Also  included is an author index, which is arranged alphabetically according to  the first author's name if the source is co-authored. It is anticipated  that this bibliography will be updated as research in the field progresses.",1975
The Mixed Method of Random Number Generation: A Tutorial,"Several motivations are recognized for user-defined random number generators  in preference to built-in generators. The mixed method of random number generation is discussed) and the conditions for achieving full period with a modulus of 2^b  are explained. Implementation of mixed random number generators is affected  both by the computer and language used. Guidelines are presented for realizing  acceptable mixed generators on several machines using the FORTRAN, PL/l and  SNOBOL4 languages.",1974
Finiteness and Bounds of Complete Test Point Sets for Program Verification,It is proven that there exists a finite set of test points that suffices to establish the equivalence of two programs s and t if some finite set S of programs can be identified that contains both s and t. It is also proven that the expected number of  those test points is bounded by the logarithm of the cardinality of S.,1976
