Title,Abstract,Date
The Impact of Lookahead on Conservative Simulation,"This paper studies the impact on the performance of conservative simulation for both open and closed models.  For open models, we derive an upper bound on the performance improvement due to the lookahead.  We show that the benefit of lookahead diminishes as the simulation length increases.  For closed models, on the other hand, the performance improvement converges to a constant as the simulation length increases.",1995-02-01
Improving Genetic Algorithm Efficiency and Reliability in the Design and Optimization of Composite Structures,"Genetic algorithms (GAs) often require many iterations for convergence.  If the cost for the analysis of each laminate is high, then GA optimization becomes infeasible due to the large amount of CPU time required.  A genetic algorithm's ability to find optimal laminate designs that have complicated stacking sequence patterns in an efficient manner may be improved if the GA takes greater advantage of all the information generated throughout the search scheme.  In a standard GA procedure, an elitist method is typically implemented where the worst laminate from the chil population is replaced with the best laminate from the parent population.  Valuable information that may exist in other laminates of the parent population is no longer utilized once the child population has been created.  The present paper suggests new multiple elitist and variable elitist schemes where more than just the best laminate from the old population may be preserved in successive generations providing the GA with additional laminate designs with good performance.  These additional designs may contain pieces of the stacking sequence pattern that are vital for achieving the optimal laminate and help the GA converge more rapidly.  Results generated by utilizing the multiple elitist and variable elitist methods have shown to yield richer final populations and minor improvements in the computational cost, while maintaining a high level of reliability.",1996-10-01
Domain Engineering: An Empirical Study,"This paper presents a summary and analysis of data gathered from thirteen domain engineering projects, participant surveys, and demographic information. Taking a failure modes approach, project data is compared to an ideal model of the DARE methodology, revealing valuable insights into points of failure in the domain engineering process. This study suggests that success is a function of the domain analyst’s command of a specific set of domain engineering concepts and skills, the time invested in the process, and persistence in difficult areas. We conclude by presenting strategies to avoid points of failure in future domain engineering projects.",2006
Prediction-Based Prefetching for Remote Rendering Streaming in Mobile Virtual Environments,"Remote Image-based rendering (IBR) is the most suitable solution for rendering complex 3D scenes on mobile devices, where the server renders the 3D scene and streams the rendered images to the client. However, sending a large number of images is inefficient due to the possible limitations of wireless connections. In this paper, we propose a prefetching scheme at the server side that predicts client movements and hence prefetches the corresponding images. In addition, an event-driven simulator was designed and implemented to evaluate the performance of the proposed scheme. The simulator was used to compare between prediction-based prefetching and prefetching images based on spatial locality. Several experiments were conducted to study the performance with different movement patterns as well as with different virtual environments (VEs). The results have shown that the hit ratio of the prediction-based scheme is greater than the localization scheme in the case of random and circular walk movement patterns by approximately 35% and 17%, respectively. In addition, for a VE with high level of details, the proposed scheme outperforms the localization scheme by approximately 13%. However, for a VE with low level of details the localization based scheme outperforms the proposed scheme by only 5%.",2007-06-01
Dynamic Working Set Memory Allocation for Concurrent Processes,"The problem of allocating a given total amount of main memory page-frames M(t) available at time t, among a given set of concurrently active processes {P-sub i} is examined.  Memory allocation is managed under the working set policy, and it is assumed that M(t) is larger than the total sum of all working-set sizes but less than the sum of distinct pages in {P-sub i}.  It is required that each process receive at least an allocation equal to its working-set size and that the excess memory be additionally distributed among the concurrent processes to enhance their performance.  The upper and lower bounds on the individual memory allocations for each process are derived.  A fair policy for apportioning the excess memory among the concurrent processes is presented.  A procedure for rounding off fragmented page apportionment is described.  An application example, illustrating dynamically changing conditions in the concurrent active processes, is described.",1990
An Assessment Of Quasi-Newton Sparse Update Techniques For Nonlinear Structural Analysis,"In this paper an attempt is made to evaluate the performance of a  few algorithms for unconstrained minimization of nonlinear functions  that exploit sparsity of the Hessians of such functions. The evaluation  is centered around large scale, geometrically nonlinear problems of  structural analysis in general. In particular, the snap-through response of finite element models of a shallow elastic arch under a concentrated load at the crown is considered. The sensitivity of these algorithms to varying degrees of refinement of these finite element models as  well as to the sparsity pattern of the Hessian of the potential surface  in question are examined. The paper concludes by making recommendations  on the choice of an algorithm based on the scale of the problem and the  degree and type of nonlinearity.",1980
Validation of Expert System Performance,"Most definitions of an expert system include some reference to the ability of the system to perform at a level close to human expert performance. Yet the validation of expert systems, that is, the testing of systems so as to ascertain that they achieve an acceptable level of performance, has (with a few exceptions) been ad-hoc, informal, and in some cases of dubious value.  This paper attempts to establish validation as an important concern in expert systems research and development. The problems in validating an expert system are discussed, and a number of methods for validating expert systems, both qualitative and quantitative, are presented.",1986
Discrete Event Simulation with Pascal,"Pascal_SIM is a collection of Pascal constants, types, variables, functions and procedures for developing event, activity, three-phase of process oriented discrete-event simulation models.  Facilities are provided for queue processing, time advance and event list maintenance, control of entities and resources, random number generation and streams, sampling from parametric and empirical distributions, statistics collection, and visual displays.",1986-06-01
Covering a Set with Arithmetic Progressions is NP-Complete,"This paper defines a new class of set covering problems in which the subsets are implicitly derived from the properties of the set elements. In particular, the set elements are integers and the subsets are finite arithmetic progressions.  Both minimum cover and exact cover problems are defined.  Both problems are shown to be NP-Complete.",1989
An Operation Model Supporting the Generation of Requirements That Capture Customer Intent,"Product quality is a direct reflection of how well it meets the cutomer's needs. Hence, the ability to capture customer requirements correctly and succinctly is paramount. Unfortunately, within software development frameworks the gathering of requirements is one of the more ill-defined and least structured processes. To address this inadequacy, our paper (a) proposes a refinement (or decomposition) to the requirements generation phase that admits to detailed examination and promotes a better understanding of where requirements generation goes wrong,(b) using the results of a preliminary study, identifies where and how miscommunication and requirements omission occur, and (c) outlines a more structured process that can be applied early in the requirements generation process to minimize requirement faults.",1999-11-01
History in the Computer Science Curriculum,"IFIP  Working Group 9.7 (History of Computing) is charged with not only encouraging the preservation of computer artifacts, the recording of the memoirs of pioneers, and the analysis of the downstream impact of computer innovations, but also on the development of educational modules on the history of computing.  This paper presents an initial report on the study of the history of computing and informatics and preliminary proposals for the inclusion of aspects of the history of computing and informatics in the curriculum of university and college students.",1995-07-01
Multimedia Traffic Analysis Using CHITRA95,"We describe how to investigate collections of trace data representing network delivery of multimedia information with CHITRA95, a tool that allows a user to visualize, query, statistically analyze and test, transform, and model collections of trace data.  CHITRA95 is applied to characterize World Wide Web (WWW) traffic from three workloads: students in a classroom of network-connected workstations, graduate students browsing the Web, undergraduates browsing educational and other materials, as well as traffic on a courseware repository server.  We explore the inter-access time of files on a server (i.e., recency), the hit rate from a proxy server cache, and the distributions of file sizes and media types requested.  The traffic study also yields statistics on the effectiveness of caching to improve transfer rates.  In contrast to past WWW traffic studies, we analyze client as well as server traffic; we compare three workloads rather than drawing conclusions from one workload; and we analyze tcpdump logs to calculate the performance improvement in throughput that an end user sees due to caching.",1995-04-01
Suitability of Optimization Packages for an MDO Environment,"An examination of the performance of several optimization packages and their suitability for inclusion in a realistic multidisciplinary design optimization (MDO) environment is conducted. The packages are incorporated into a High-Speed Civil Transport (HSCT) aircraft design code and are used with both a response surface (RS) model and a more detailed, noisy model.  While most packages converge to similar designs, there are large variations in CPU times and usability. Results are reported for a SGI workstation.",1996-10-01
The Global Stability of a Rigid Solid Supported by Elastic Columns,"A new stability index, the global critical load, is advocated.  This index is useful for flexible structures prone to large disturbances such as earthquakes.  A symmetric rigid body supported by flexible legs is studied in detail.  The nonlinear equilibrium equations are solved and the results show that global stability depends heavily on the height of the mass center and the distance between the legs.",1994
Response Surface Models Combining Linear and Euler Aerodynamics for HSCT Design,"A method has been developed to efficiently implement supersonic aerodynamic predictions from Euler solutions into a highly constrained, multidisciplinary design optimization of a High-Speed Civil Transport.  The method alleviates the large computational burden associated with performing computational fluid dynamics analyses through the use of variable-complexity modeling techniques, response surface methodologies, and coarse grained parallel computing.  Using information gained from lower fidelity aerodynamic models, reduced term response surface models representing a correction to the linear theory response surface model predictions are constructed using Euler solutions.  Studies into five, ten, fifteen, and twenty variable design problems show that accurate results can be obtained with the reduced term models at a fraction of the cost of creating the full term quadratic response surface models.  Specifically, a savings of 255 CPU hours out of 392 CPU hours required to create the full term response surface model is obtained for the twenty variable problem on a single 75 MHz IP21 processor of a SGI Power Challenge.",1998-08-01
Performance Analysis of a Novel GPU Computation-to-core Mapping Scheme for Robust Facet Image Modeling,"Though the GPGPU concept is well-known in image processing, much more work remains to be done to fully exploit GPUs as an alternative computation engine. This paper investigates the computation-to-core mapping strategies to probe the efficiency and scalability of the robust facet image modeling algorithm on GPUs. Our fine-grained computation-to-core mapping scheme shows a significant performance gain over the standard pixel-wise mapping scheme. With in-depth performance comparisons across the two different mapping schemes, we analyze the impact of the level of parallelism on the GPU computation and suggest two principles for optimizing future image processing applications on the GPU platform.",2012
A Practical Blended Analysis for Dynamic Features in JavaScript,"JavaScript is widely used in Web applications; however, its dynamism renders static analysis ineffective. Our JavaScript Blended Analysis Framework is designed to handle JavaScript dynamic features. It performs a flexible combined static/dynamic analysis. The blended analysis focuses static analysis on a dynamic calling structure collected at runtime in a lightweight manner, and refines the static analysis using dynamic information. The framework is instantiated for points-to analysis with stmt-level MOD analysis and tainted input analysis. Using JavaScript codes from actual webpages as benchmarks, we show that blended points-to analysis for JavaScript obtains good coverage (86.6% on average per website) of the pure static analysis solution and finds additional points-to pairs (7.0% on average per website) contributed by dynamically generated/loaded code. Blended tainted input analysis reports all 6 true positives reported by static analysis, but without false alarms, and finds three additional true positives.",2012
Granularity Issues for Solving Polynomial Systems via Globally Convergent Algorithms on a Hypercube,"Polynomial systems of equations frequently arise in many applications such as solid modeling, robotics, computer vision, chemistry, chemical engineering, and mechanical engineering . Locally convergent iterative methods such as quasi-Newton methods may diverge or fail to find all meaningful solutions of a polynomial system. Recently a homotopy algorithm has been proposed for polynomial systems that is guaranteed globally convergent (always converges from an arbitrary starting point) with probability one, finds all solutions to the polynomial system, and has a large amount of inherent parallelism. There are several ways the homotopy algorithms can be decomposed to run on a hypercube. The granularity of a decomposition has a profound effect on the performance of the algorithm. The results of decompositions with two different granularities are presented. The experiments were conducted on an iPSC-16 hypercube using actual industrial problems.",1988-05-01
"Design Issues in General Purpose, Parallel Simulation Languages","This paper addresses the topic of designing general purpose, parallel simulation languages.  We discuss how parallel simulation languages differ from general purpose programming languages.  Our thesis is that the issues of distribution, performance, unusual implementation mechanism, and the desire for determinism are the dominant considerations in designing a simulation language today.  We then discuss the separate roles that special and general purpose simulation languages play.  Next we use the two languages, Sim++ and CPS, to illustrate these issues.  Then we discuss eight design considerations: process versus event oriented-view, basic program structure, I/O, making implementation cost explicit to the programmer, providing dynamic facilities, memory management, the semantics of false messages in time warp, and program development methodology considerations.  A number of conclusions are drawn from our experiences in language design.",1989
Implications of Using the Event Scheduling World View for Parallel Simulation,"Use of a particular world view, or conceptual framework, makes the programming of many simulations easier.  Parallel simulation implementations generally have not been based on a particular world view.  An open question is what impact a world view has on the execution of a simulation in parallel.",1990
Performance Evaluation of Three Algorithms to Generate Fundamental Cycles for Twelve Different Graphs,No abstract available.,1982
Personalization by Partial Evaluation.,"The central contribution of this paper is to model personalization by the programmatic notion of partial evaluation.Partial evaluation is a technique used to automatically specialize programs, given incomplete information about their input.The methodology presented here models a collection of information resources as a program (which abstracts the underlying schema of organization and ﬂow of information),partially evaluates the program with respect to user input,and recreates a personalized site from the specialized program.This enables a customizable methodology called PIPE that supports the automatic specialization of resources,without enumerating the interaction sequences beforehand .Issues relating to the scalability of PIPE,information integration,sessioniz-ling scenarios,and case studies are presented.",2001
A Study and Project-Based Evaluation of the Software Engineering Evaluation System (SEES),"The purpose of this document is to describe the design and execution of the quasi-experiment conducted in the Department of Computer Science, Virginia Tech, in accordance with the procedures described in the document ""An Experimental Design for Evaluating SEES"" prepared for NASA under contract NAS1-19610, Task 17. (Hereafter, that report is called the general design document.)  The quasi-experiment serves three important purposes.  First, the quasi-experiment is the proof of concept of the general experiment design.  It shows that the procedures defined in the general experiment design can be implemented. Second, provides details for setting up a true experiment: identifying the research hypothesis, designing the investigation, selecting various variables, procedures, and controls, measuring the variables, and evaluating the results.  Third, any insights revealed during the course of the quasi-experiment can be incorporated in the costly true experiment, thus providing a cost-effective experimental methodology. This report contains sufficient information so that the quasi-experiment can be replicated at an appropriate level of abstraction.  We also document and interpret all the results of the quasi-experiment.",1997-02-01
Designing a Testing Strategy for Expert Systems,"Testing programs with tractable algorithms is one area in which software engineers have made numerous advances over the past few decades.  Testing rule-based expert systems, however, is a new area in software engineering which requires new testing techniques.  For the most part, traditional software engineering testing strategies assume modular program development. This is assumption impractical to make for expert system development, for the knowledge base of an expert system is quite simply a huge non-modular program. It consists almost entirely of non-ordered, multi-branching decision statements. In traditional programming, the module interfaces are limited and well defined. For rule-based expert systems, the interaction among rules is combinatoric and highly data-driven. Thus, the testing of a completed expert system via traditional path analysis is impractical. The design of a testing strategy for expert systems focuses on the generic phases of expert system development.  Briefly, these phases include system definition, incremental system implementation, and system maintenance. Using this simplified breakdown of the expert system development process as a guide, certain testing techniques can be generalized enough to work for any expert system application.",1988
Report on Quasi-Experiment for Evaluating SEES,"The purpose of this document is to describe the design and execution of the quasi-experiment conducted in the Department of Computer Science, Virginia Tech, in accordance with the procedures described in the document, ""An Experimental Design for Evaluating SEES"" prepared for NASA under contract NASI-19610, Task 17. (Hereafter that report is called the general design document.) The quasi-experiment serves three important purposes. First, the quasi-experiment is the proof of concept of the general experiment design. It shows that the procedures defined in the general experiment design can be implemented. Second, provides details for setting up a true experiment: identifying the research hypothesis, designing the investigation, selecting various variables, procedures, and controls, measuring the variables, and evaluating the results. Third, any insights revealed during the course of the quasi-experiment can be incorporated in the costly true experiment, thus providing a cost-effective experimental methodology. This report contains sufficient information so that the quasi-experiment can be replicated at an appropriate level of abstraction. We also document and interpret all the results of the quasi-experiment.",1995-12-01
Software Reuse and Reusability Metrics and Models,"As organizations implement systematic software reuse programs to improve productivity and quality, they must be able to measure their progress and identify the most effective reuse strategies.  This is done with reuse metrics and models.  In this paper, we survey metrics and models of software reuse and reusability, and provide a classification structure that will help users select them.  Six types of metrics and models are reviewed: cost-benefit models, maturity assessment models, amount of reuse metrics, failure modes models, reusability assessment models, and reuse library metrics.",1995-05-01
ACT++ 2.0: A Class Library for Concurrent Programming in C++ Using Actors,"ACT++ 2.0 is the most recent version of a class library for concurrent programming in C++. The underlying model of concurrent computation is the Actor model. Programs in ACT++ consist of a collection of active objects called actors. Actors execute concurrently and cooperate by sending request and reply messages. An agent, termed the behavior of an actor, is responsible for processing a single request message and for specifying a replacement behavior which processes the next available request message. One of the salient features of ACT++ is its ability to handle the Inheritance Anomaly---the interference between the inheritance mechanism of object-oriented languages and the specification of synchronization constraints in the methods of a class---using the notion of behavior sets. ACT++ has been implemented on the Sequent Symmetry multiprocessor using the PRESTO threads package.",1992
Solving Finite Difference Approximations to Nonlinear Two-point Boundary Value Problems by a Homotopy Method,"The Chow-Yorke algorithm is a homotopy method that has been proved globally convergent for Brouwer fixed point problems, classes of zero finding, nonlinear programming, and two-point boundary value problems. The method is numerically stable, and has been successfully applied to several practical nonlinear optimization and fluid dynamics problems. Previous application of the homotopy method to two-point boundary value problems has been based  on shooting, which is inappropriate for fluid dynamics problems with sharp boundary layers. Here the Chow-Yorke algorithm is proved globally convergent for a class of finite difference approximations to nonlinear two-point boundary value problems. The numerical implementation of the algorithm is briefly sketched, and computational results are given for two fairly difficult fluid dynamics boundary value problems.",1979
A Query Language for Information Graphs,"In this paper we propose a database model and query language for information retrieval systems.  The information graph model and Graph Object Access Language (GOAL) allow integrated handling of data, information and knowledge along with a variety of specialized objects (e.g., for geographic or multimedia information systems).  There is flexible support for hyperbases, thesauri, lexicons, and both relational and object-oriented types of DBMS applications.  In this paper we give the first published account of our new, powerful model and language (GOAL), illustrate their use, and compare them with related work.",1993
